program_id,application_system,admission_track,admission_group,choice_code,school_id,school_source_id,school_name_zh,department_name_zh,department_name_clean_zh,department_name_en,department_name_en_source,is_key_industry_program,is_international_foundation_program,source_pdf_page,source_section,notes
joint_group2_2001,joint_distribution,joint_distribution,第二類組,2001,school_001_國立臺灣大學,1,國立臺灣大學,數學系,數學系,Department of Mathematics,draft_glossary_translation,False,False,51,附錄二之二 聯合分發制招生校系名稱及代碼表：第二類組,
joint_group2_2002,joint_distribution,joint_distribution,第二類組,2002,school_001_國立臺灣大學,1,國立臺灣大學,物理學系,物理學系,Department of Physics,draft_glossary_translation,False,False,51,附錄二之二 聯合分發制招生校系名稱及代碼表：第二類組,
joint_group2_2003,joint_distribution,joint_distribution,第二類組,2003,school_001_國立臺灣大學,1,國立臺灣大學,化學系,化學系,Department of Chemistry,draft_glossary_translation,False,False,51,附錄二之二 聯合分發制招生校系名稱及代碼表：第二類組,
joint_group2_2004,joint_distribution,joint_distribution,第二類組,2004,school_001_國立臺灣大學,1,國立臺灣大學,地質科學系,地質科學系,Department of Geography Quality Science,draft_glossary_translation,False,False,51,附錄二之二 聯合分發制招生校系名稱及代碼表：第二類組,
joint_group2_2005,joint_distribution,joint_distribution,第二類組,2005,school_001_國立臺灣大學,1,國立臺灣大學,地理環境資源學系,地理環境資源學系,Department of Geography Environmental Resources,draft_glossary_translation,False,False,51,附錄二之二 聯合分發制招生校系名稱及代碼表：第二類組,
joint_group2_2006,joint_distribution,joint_distribution,第二類組,2006,school_001_國立臺灣大學,1,國立臺灣大學,大氣科學系,大氣科學系,Department of Atmospheric Sciences Science,draft_glossary_translation,False,False,51,附錄二之二 聯合分發制招生校系名稱及代碼表：第二類組,
joint_group2_2007,joint_distribution,joint_distribution,第二類組,2007,school_001_國立臺灣大學,1,國立臺灣大學,土木工程學系,土木工程學系,Department of Civil Engineering,draft_glossary_translation,False,False,51,附錄二之二 聯合分發制招生校系名稱及代碼表：第二類組,
joint_group2_2008,joint_distribution,joint_distribution,第二類組,2008,school_001_國立臺灣大學,1,國立臺灣大學,機械工程學系,機械工程學系,Department of Mechanical Engineering,draft_glossary_translation,False,False,51,附錄二之二 聯合分發制招生校系名稱及代碼表：第二類組,
joint_group2_2009,joint_distribution,joint_distribution,第二類組,2009,school_001_國立臺灣大學,1,國立臺灣大學,化學工程學系,化學工程學系,Department of Chemical Engineering,draft_glossary_translation,False,False,51,附錄二之二 聯合分發制招生校系名稱及代碼表：第二類組,
joint_group2_2010,joint_distribution,joint_distribution,第二類組,2010,school_001_國立臺灣大學,1,國立臺灣大學,工程科學及海洋工程學系,工程科學及海洋工程學系,Department of Engineering Science Studies and Marine Engineering,draft_glossary_translation,False,False,51,附錄二之二 聯合分發制招生校系名稱及代碼表：第二類組,
joint_group2_2011,joint_distribution,joint_distribution,第二類組,2011,school_001_國立臺灣大學,1,國立臺灣大學,材料科學與工程學系,材料科學與工程學系,Department of Materials Science and Engineering,draft_glossary_translation,False,False,51,附錄二之二 聯合分發制招生校系名稱及代碼表：第二類組,
joint_group2_2012,joint_distribution,joint_distribution,第二類組,2012,school_001_國立臺灣大學,1,國立臺灣大學,電機工程學系,電機工程學系,Department of Electrical Engineering,draft_glossary_translation,False,False,51,附錄二之二 聯合分發制招生校系名稱及代碼表：第二類組,
joint_group2_2013,joint_distribution,joint_distribution,第二類組,2013,school_001_國立臺灣大學,1,國立臺灣大學,資訊工程學系,資訊工程學系,Department of Computer Science and Information Engineering,draft_glossary_translation,False,False,51,附錄二之二 聯合分發制招生校系名稱及代碼表：第二類組,
joint_group2_2014,joint_distribution,joint_distribution,第二類組,2014,school_001_國立臺灣大學,1,國立臺灣大學,生物環境系統工程學系,生物環境系統工程學系,Department of Biology Environment Department Systems Engineering,draft_glossary_translation,False,False,51,附錄二之二 聯合分發制招生校系名稱及代碼表：第二類組,
joint_group2_2015,joint_distribution,joint_distribution,第二類組,2015,school_001_國立臺灣大學,1,國立臺灣大學,生物機電工程學系,生物機電工程學系,Department of Biomechatronics Engineering,draft_glossary_translation,False,False,51,附錄二之二 聯合分發制招生校系名稱及代碼表：第二類組,
joint_group2_2016,joint_distribution,joint_distribution,第二類組,2016,school_001_國立臺灣大學,1,國立臺灣大學,工商管理學系科技管理組,工商管理學系科技管理組,"Department of Business Administration, Technology Management Group",draft_glossary_translation,False,False,51,附錄二之二 聯合分發制招生校系名稱及代碼表：第二類組,
joint_group2_2017,joint_distribution,joint_distribution,第二類組,2017,school_001_國立臺灣大學,1,國立臺灣大學,資訊管理學系,資訊管理學系,Department of Information Management,draft_glossary_translation,False,False,51,附錄二之二 聯合分發制招生校系名稱及代碼表：第二類組,
joint_group2_2018,joint_distribution,joint_distribution,第二類組,2018,school_001_國立臺灣大學,1,國立臺灣大學,醫學工程學系,醫學工程學系,Department of Medicine Engineering,draft_glossary_translation,False,False,51,附錄二之二 聯合分發制招生校系名稱及代碼表：第二類組,
joint_group2_2020,joint_distribution,joint_distribution,第二類組,2020,school_006_國立成功大學,6,國立成功大學,物理學系,物理學系,Department of Physics,draft_glossary_translation,False,False,51,附錄二之二 聯合分發制招生校系名稱及代碼表：第二類組,
joint_group2_2021,joint_distribution,joint_distribution,第二類組,2021,school_006_國立成功大學,6,國立成功大學,化學系,化學系,Department of Chemistry,draft_glossary_translation,False,False,51,附錄二之二 聯合分發制招生校系名稱及代碼表：第二類組,
joint_group2_2022,joint_distribution,joint_distribution,第二類組,2022,school_006_國立成功大學,6,國立成功大學,地球科學系,地球科學系,Department of Earth Science Science,draft_glossary_translation,False,False,51,附錄二之二 聯合分發制招生校系名稱及代碼表：第二類組,
joint_group2_2023,joint_distribution,joint_distribution,第二類組,2023,school_006_國立成功大學,6,國立成功大學,統計與資料科學學系,統計與資料科學學系,Department of Statistics and Data Science,draft_glossary_translation,False,False,51,附錄二之二 聯合分發制招生校系名稱及代碼表：第二類組,
joint_group2_2024,joint_distribution,joint_distribution,第二類組,2024,school_006_國立成功大學,6,國立成功大學,工業與資訊管理學系,工業與資訊管理學系,Department of Industrial and Information Management,draft_glossary_translation,False,False,51,附錄二之二 聯合分發制招生校系名稱及代碼表：第二類組,
joint_group2_2025,joint_distribution,joint_distribution,第二類組,2025,school_006_國立成功大學,6,國立成功大學,交通管理科學系,交通管理科學系,Department of Exchange Communication Management Science,draft_glossary_translation,False,False,51,附錄二之二 聯合分發制招生校系名稱及代碼表：第二類組,
joint_group2_2026,joint_distribution,joint_distribution,第二類組,2026,school_006_國立成功大學,6,國立成功大學,機械工程學系,機械工程學系,Department of Mechanical Engineering,draft_glossary_translation,False,False,51,附錄二之二 聯合分發制招生校系名稱及代碼表：第二類組,
joint_group2_2027,joint_distribution,joint_distribution,第二類組,2027,school_006_國立成功大學,6,國立成功大學,航空太空工程學系,航空太空工程學系,Department of Aeronautics and Astronautics Engineering,draft_glossary_translation,False,False,51,附錄二之二 聯合分發制招生校系名稱及代碼表：第二類組,
joint_group2_2028,joint_distribution,joint_distribution,第二類組,2028,school_006_國立成功大學,6,國立成功大學,化學工程學系,化學工程學系,Department of Chemical Engineering,draft_glossary_translation,False,False,51,附錄二之二 聯合分發制招生校系名稱及代碼表：第二類組,
joint_group2_2029,joint_distribution,joint_distribution,第二類組,2029,school_006_國立成功大學,6,國立成功大學,資源工程學系,資源工程學系,Department of Resources Engineering,draft_glossary_translation,False,False,51,附錄二之二 聯合分發制招生校系名稱及代碼表：第二類組,
joint_group2_2030,joint_distribution,joint_distribution,第二類組,2030,school_006_國立成功大學,6,國立成功大學,材料科學及工程學系,材料科學及工程學系,Department of Materials Science Studies and Engineering,draft_glossary_translation,False,False,51,附錄二之二 聯合分發制招生校系名稱及代碼表：第二類組,
joint_group2_2031,joint_distribution,joint_distribution,第二類組,2031,school_006_國立成功大學,6,國立成功大學,土木工程學系,土木工程學系,Department of Civil Engineering,draft_glossary_translation,False,False,51,附錄二之二 聯合分發制招生校系名稱及代碼表：第二類組,
joint_group2_2032,joint_distribution,joint_distribution,第二類組,2032,school_006_國立成功大學,6,國立成功大學,環境工程學系,環境工程學系,Department of Environmental Engineering,draft_glossary_translation,False,False,51,附錄二之二 聯合分發制招生校系名稱及代碼表：第二類組,
joint_group2_2033,joint_distribution,joint_distribution,第二類組,2033,school_006_國立成功大學,6,國立成功大學,水利及海洋工程學系,水利及海洋工程學系,Department of Hydraulic and Ocean Engineering,draft_glossary_translation,False,False,51,附錄二之二 聯合分發制招生校系名稱及代碼表：第二類組,
joint_group2_2034,joint_distribution,joint_distribution,第二類組,2034,school_006_國立成功大學,6,國立成功大學,工程科學系,工程科學系,Department of Engineering Science,draft_glossary_translation,False,False,51,附錄二之二 聯合分發制招生校系名稱及代碼表：第二類組,
joint_group2_2035,joint_distribution,joint_distribution,第二類組,2035,school_006_國立成功大學,6,國立成功大學,系統及船舶機電工程學系,系統及船舶機電工程學系,Department Systems and Marine Mechatronic Engineering,draft_glossary_translation,False,False,51,附錄二之二 聯合分發制招生校系名稱及代碼表：第二類組,
joint_group2_2036,joint_distribution,joint_distribution,第二類組,2036,school_006_國立成功大學,6,國立成功大學,測量及空間資訊學系,測量及空間資訊學系,Department of Surveying and Spatial Design Information,draft_glossary_translation,False,False,51,附錄二之二 聯合分發制招生校系名稱及代碼表：第二類組,
joint_group2_2037,joint_distribution,joint_distribution,第二類組,2037,school_006_國立成功大學,6,國立成功大學,電機工程學系,電機工程學系,Department of Electrical Engineering,draft_glossary_translation,False,False,51,附錄二之二 聯合分發制招生校系名稱及代碼表：第二類組,
joint_group2_2038,joint_distribution,joint_distribution,第二類組,2038,school_006_國立成功大學,6,國立成功大學,資訊工程學系,資訊工程學系,Department of Computer Science and Information Engineering,draft_glossary_translation,False,False,51,附錄二之二 聯合分發制招生校系名稱及代碼表：第二類組,
joint_group2_2039,joint_distribution,joint_distribution,第二類組,2039,school_006_國立成功大學,6,國立成功大學,生物醫學工程學系,生物醫學工程學系,Department of Biomedical Engineering,draft_glossary_translation,False,False,51,附錄二之二 聯合分發制招生校系名稱及代碼表：第二類組,
joint_group2_2040,joint_distribution,joint_distribution,第二類組,2040,school_006_國立成功大學,6,國立成功大學,建築學系,建築學系,Department of Architecture,draft_glossary_translation,False,False,51,附錄二之二 聯合分發制招生校系名稱及代碼表：第二類組,
joint_group2_2041,joint_distribution,joint_distribution,第二類組,2041,school_006_國立成功大學,6,國立成功大學,都市計劃學系,都市計劃學系,Department of Urban Urban Design Planning,draft_glossary_translation,False,False,51,附錄二之二 聯合分發制招生校系名稱及代碼表：第二類組,
joint_group2_2042,joint_distribution,joint_distribution,第二類組,2042,school_006_國立成功大學,6,國立成功大學,工業設計學系,工業設計學系,Department of Industrial Design,draft_glossary_translation,False,False,51,附錄二之二 聯合分發制招生校系名稱及代碼表：第二類組,
joint_group2_2043,joint_distribution,joint_distribution,第二類組,2043,school_006_國立成功大學,6,國立成功大學,光電科學與工程學系,光電科學與工程學系,Department of Optoelectronic Science and Engineering,draft_glossary_translation,False,False,51,附錄二之二 聯合分發制招生校系名稱及代碼表：第二類組,
joint_group2_2044,joint_distribution,joint_distribution,第二類組,2044,school_006_國立成功大學,6,國立成功大學,能源工程國際學士學位學程,能源工程國際學士學位學程,Bachelor Program in Energy Engineering International,draft_glossary_translation,False,False,51,附錄二之二 聯合分發制招生校系名稱及代碼表：第二類組,
joint_group2_2045,joint_distribution,joint_distribution,第二類組,2045,school_015_國立嘉義大學,15,國立嘉義大學,資訊管理學系,資訊管理學系,Department of Information Management,draft_glossary_translation,False,False,51,附錄二之二 聯合分發制招生校系名稱及代碼表：第二類組,
joint_group2_2046,joint_distribution,joint_distribution,第二類組,2046,school_015_國立嘉義大學,15,國立嘉義大學,電子物理學系,電子物理學系,Department of Electronic Physics,draft_glossary_translation,False,False,51,附錄二之二 聯合分發制招生校系名稱及代碼表：第二類組,
joint_group2_2047,joint_distribution,joint_distribution,第二類組,2047,school_015_國立嘉義大學,15,國立嘉義大學,應用數學系,應用數學系,Department of Applied Mathematics,draft_glossary_translation,False,False,51,附錄二之二 聯合分發制招生校系名稱及代碼表：第二類組,
joint_group2_2048,joint_distribution,joint_distribution,第二類組,2048,school_015_國立嘉義大學,15,國立嘉義大學,應用化學系,應用化學系,Department of Applied Chemistry,draft_glossary_translation,False,False,51,附錄二之二 聯合分發制招生校系名稱及代碼表：第二類組,
joint_group2_2049,joint_distribution,joint_distribution,第二類組,2049,school_015_國立嘉義大學,15,國立嘉義大學,土木與水資源工程學系,土木與水資源工程學系,Department of Civil Wood and Water Resources Engineering,draft_glossary_translation,False,False,51,附錄二之二 聯合分發制招生校系名稱及代碼表：第二類組,
joint_group2_2050,joint_distribution,joint_distribution,第二類組,2050,school_015_國立嘉義大學,15,國立嘉義大學,生物機電工程學系,生物機電工程學系,Department of Biomechatronics Engineering,draft_glossary_translation,False,False,51,附錄二之二 聯合分發制招生校系名稱及代碼表：第二類組,
joint_group2_2051,joint_distribution,joint_distribution,第二類組,2051,school_015_國立嘉義大學,15,國立嘉義大學,資訊工程學系,資訊工程學系,Department of Computer Science and Information Engineering,draft_glossary_translation,False,False,51,附錄二之二 聯合分發制招生校系名稱及代碼表：第二類組,
joint_group2_2052,joint_distribution,joint_distribution,第二類組,2052,school_015_國立嘉義大學,15,國立嘉義大學,電機工程學系,電機工程學系,Department of Electrical Engineering,draft_glossary_translation,False,False,51,附錄二之二 聯合分發制招生校系名稱及代碼表：第二類組,
joint_group2_2053,joint_distribution,joint_distribution,第二類組,2053,school_015_國立嘉義大學,15,國立嘉義大學,機械與能源工程學系,機械與能源工程學系,Department of Mechanical Engineering and Energy Engineering,draft_glossary_translation,False,False,51,附錄二之二 聯合分發制招生校系名稱及代碼表：第二類組,
joint_group2_2054,joint_distribution,joint_distribution,第二類組,2054,school_002_國立暨南國際大學,2,國立暨南國際大學,資訊工程學系(重點產業系所),資訊工程學系,Department of Computer Science and Information Engineering,draft_glossary_translation,True,False,51,附錄二之二 聯合分發制招生校系名稱及代碼表：第二類組,
joint_group2_2055,joint_distribution,joint_distribution,第二類組,2055,school_002_國立暨南國際大學,2,國立暨南國際大學,土木工程學系(重點產業系所),土木工程學系,Department of Civil Engineering,draft_glossary_translation,True,False,51,附錄二之二 聯合分發制招生校系名稱及代碼表：第二類組,
joint_group2_2056,joint_distribution,joint_distribution,第二類組,2056,school_002_國立暨南國際大學,2,國立暨南國際大學,電機工程學系(重點產業系所),電機工程學系,Department of Electrical Engineering,draft_glossary_translation,True,False,51,附錄二之二 聯合分發制招生校系名稱及代碼表：第二類組,
joint_group2_2057,joint_distribution,joint_distribution,第二類組,2057,school_002_國立暨南國際大學,2,國立暨南國際大學,應用化學系(重點產業系所),應用化學系,Department of Applied Chemistry,draft_glossary_translation,True,False,51,附錄二之二 聯合分發制招生校系名稱及代碼表：第二類組,
joint_group2_2058,joint_distribution,joint_distribution,第二類組,2058,school_002_國立暨南國際大學,2,國立暨南國際大學,應用材料及光電工程學系(重點產業系所),應用材料及光電工程學系,Department of Applied Materials and Optoelectronic Engineering,draft_glossary_translation,True,False,51,附錄二之二 聯合分發制招生校系名稱及代碼表：第二類組,
joint_group2_2059,joint_distribution,joint_distribution,第二類組,2059,school_002_國立暨南國際大學,2,國立暨南國際大學,科技學院學士班(重點產業系所),科技學院學士班,Bachelor Program in College of Technology,draft_glossary_translation,True,False,51,附錄二之二 聯合分發制招生校系名稱及代碼表：第二類組,
joint_group2_2064,joint_distribution,joint_distribution,第二類組,2064,school_010_國立中興大學,10,國立中興大學,化學系,化學系,Department of Chemistry,draft_glossary_translation,False,False,51,附錄二之二 聯合分發制招生校系名稱及代碼表：第二類組,
joint_group2_2065,joint_distribution,joint_distribution,第二類組,2065,school_010_國立中興大學,10,國立中興大學,應用數學系應用數學組,應用數學系應用數學組,"Department of Applied Mathematics, Applied Mathematics Group",draft_glossary_translation,False,False,51,附錄二之二 聯合分發制招生校系名稱及代碼表：第二類組,
joint_group2_2066,joint_distribution,joint_distribution,第二類組,2066,school_010_國立中興大學,10,國立中興大學,物理學系一般物理組,物理學系一般物理組,"Department of Physics, General Physics Group",draft_glossary_translation,False,False,51,附錄二之二 聯合分發制招生校系名稱及代碼表：第二類組,
joint_group2_2067,joint_distribution,joint_distribution,第二類組,2067,school_010_國立中興大學,10,國立中興大學,資訊工程學系,資訊工程學系,Department of Computer Science and Information Engineering,draft_glossary_translation,False,False,51,附錄二之二 聯合分發制招生校系名稱及代碼表：第二類組,
joint_group2_2068,joint_distribution,joint_distribution,第二類組,2068,school_010_國立中興大學,10,國立中興大學,土木工程學系,土木工程學系,Department of Civil Engineering,draft_glossary_translation,False,False,51,附錄二之二 聯合分發制招生校系名稱及代碼表：第二類組,
joint_group2_2069,joint_distribution,joint_distribution,第二類組,2069,school_010_國立中興大學,10,國立中興大學,機械工程學系,機械工程學系,Department of Mechanical Engineering,draft_glossary_translation,False,False,51,附錄二之二 聯合分發制招生校系名稱及代碼表：第二類組,
joint_group2_2070,joint_distribution,joint_distribution,第二類組,2070,school_010_國立中興大學,10,國立中興大學,環境工程學系,環境工程學系,Department of Environmental Engineering,draft_glossary_translation,False,False,51,附錄二之二 聯合分發制招生校系名稱及代碼表：第二類組,
joint_group2_2071,joint_distribution,joint_distribution,第二類組,2071,school_010_國立中興大學,10,國立中興大學,電機工程學系,電機工程學系,Department of Electrical Engineering,draft_glossary_translation,False,False,51,附錄二之二 聯合分發制招生校系名稱及代碼表：第二類組,
joint_group2_2072,joint_distribution,joint_distribution,第二類組,2072,school_010_國立中興大學,10,國立中興大學,化學工程學系,化學工程學系,Department of Chemical Engineering,draft_glossary_translation,False,False,51,附錄二之二 聯合分發制招生校系名稱及代碼表：第二類組,
joint_group2_2073,joint_distribution,joint_distribution,第二類組,2073,school_010_國立中興大學,10,國立中興大學,材料科學與工程學系,材料科學與工程學系,Department of Materials Science and Engineering,draft_glossary_translation,False,False,51,附錄二之二 聯合分發制招生校系名稱及代碼表：第二類組,
joint_group2_2074,joint_distribution,joint_distribution,第二類組,2074,school_010_國立中興大學,10,國立中興大學,生物產業機電工程學系,生物產業機電工程學系,Department of Biology Industry Industry Mechatronic Engineering,draft_glossary_translation,False,False,51,附錄二之二 聯合分發制招生校系名稱及代碼表：第二類組,
joint_group2_2075,joint_distribution,joint_distribution,第二類組,2075,school_010_國立中興大學,10,國立中興大學,水土保持學系,水土保持學系,Department of Soil and Water Conservation,draft_glossary_translation,False,False,51,附錄二之二 聯合分發制招生校系名稱及代碼表：第二類組,
joint_group2_2076,joint_distribution,joint_distribution,第二類組,2076,school_010_國立中興大學,10,國立中興大學,物理學系光電物理組,物理學系光電物理組,"Department of Physics, Optoelectronic Physics Group",draft_glossary_translation,False,False,51,附錄二之二 聯合分發制招生校系名稱及代碼表：第二類組,
joint_group2_2078,joint_distribution,joint_distribution,第二類組,2078,school_010_國立中興大學,10,國立中興大學,應用數學系數據科學與計算組,應用數學系數據科學與計算組,"Department of Applied Mathematics, Data Science and Design Computing Group",draft_glossary_translation,False,False,51,附錄二之二 聯合分發制招生校系名稱及代碼表：第二類組,
joint_group2_2079,joint_distribution,joint_distribution,第二類組,2079,school_010_國立中興大學,10,國立中興大學,智慧創意工程學士學位學程,智慧創意工程學士學位學程,Bachelor Program in Intelligent Intelligence Creative Creative Engineering,draft_glossary_translation,False,False,51,附錄二之二 聯合分發制招生校系名稱及代碼表：第二類組,
joint_group2_2080,joint_distribution,joint_distribution,第二類組,2080,school_011_國立中正大學,11,國立中正大學,數學系,數學系,Department of Mathematics,draft_glossary_translation,False,False,51,附錄二之二 聯合分發制招生校系名稱及代碼表：第二類組,
joint_group2_2081,joint_distribution,joint_distribution,第二類組,2081,school_011_國立中正大學,11,國立中正大學,物理學系,物理學系,Department of Physics,draft_glossary_translation,False,False,51,附錄二之二 聯合分發制招生校系名稱及代碼表：第二類組,
joint_group2_2082,joint_distribution,joint_distribution,第二類組,2082,school_011_國立中正大學,11,國立中正大學,化學暨生物化學系,化學暨生物化學系,Department of Chemistry and Biology Chemistry,draft_glossary_translation,False,False,51,附錄二之二 聯合分發制招生校系名稱及代碼表：第二類組,
