program_id,application_system,admission_track,admission_group,choice_code,school_id,school_source_id,school_name_zh,department_name_zh,department_name_clean_zh,department_name_en,department_name_en_source,is_key_industry_program,is_international_foundation_program,source_pdf_page,source_section,notes
joint_group2_2319,joint_distribution,joint_distribution,第二類組,2319,school_040_逢甲大學,40,逢甲大學,纖維與複合材料學系,纖維與複合材料學系,Department of Fiber and Composite Integrated Materials,draft_glossary_translation,False,False,53,附錄二之二 聯合分發制招生校系名稱及代碼表：第二類組,
joint_group2_2320,joint_distribution,joint_distribution,第二類組,2320,school_040_逢甲大學,40,逢甲大學,化學工程學系,化學工程學系,Department of Chemical Engineering,draft_glossary_translation,False,False,53,附錄二之二 聯合分發制招生校系名稱及代碼表：第二類組,
joint_group2_2321,joint_distribution,joint_distribution,第二類組,2321,school_040_逢甲大學,40,逢甲大學,航太與系統工程學系,航太與系統工程學系,Department of Aviation Pacific and Department Systems Engineering,draft_glossary_translation,False,False,53,附錄二之二 聯合分發制招生校系名稱及代碼表：第二類組,
joint_group2_2322,joint_distribution,joint_distribution,第二類組,2322,school_040_逢甲大學,40,逢甲大學,應用數學系,應用數學系,Department of Applied Mathematics,draft_glossary_translation,False,False,53,附錄二之二 聯合分發制招生校系名稱及代碼表：第二類組,
joint_group2_2323,joint_distribution,joint_distribution,第二類組,2323,school_040_逢甲大學,40,逢甲大學,材料科學與工程學系,材料科學與工程學系,Department of Materials Science and Engineering,draft_glossary_translation,False,False,53,附錄二之二 聯合分發制招生校系名稱及代碼表：第二類組,
joint_group2_2324,joint_distribution,joint_distribution,第二類組,2324,school_040_逢甲大學,40,逢甲大學,環境工程與科學學系,環境工程與科學學系,Department of Environmental Engineering and Science Studies,draft_glossary_translation,False,False,53,附錄二之二 聯合分發制招生校系名稱及代碼表：第二類組,
joint_group2_2325,joint_distribution,joint_distribution,第二類組,2325,school_040_逢甲大學,40,逢甲大學,光電科學與工程學系,光電科學與工程學系,Department of Optoelectronic Science and Engineering,draft_glossary_translation,False,False,53,附錄二之二 聯合分發制招生校系名稱及代碼表：第二類組,
joint_group2_2326,joint_distribution,joint_distribution,第二類組,2326,school_040_逢甲大學,40,逢甲大學,資訊工程學系,資訊工程學系,Department of Computer Science and Information Engineering,draft_glossary_translation,False,False,53,附錄二之二 聯合分發制招生校系名稱及代碼表：第二類組,
joint_group2_2327,joint_distribution,joint_distribution,第二類組,2327,school_040_逢甲大學,40,逢甲大學,電子工程學系,電子工程學系,Department of Electronic Engineering,draft_glossary_translation,False,False,53,附錄二之二 聯合分發制招生校系名稱及代碼表：第二類組,
joint_group2_2328,joint_distribution,joint_distribution,第二類組,2328,school_040_逢甲大學,40,逢甲大學,電機工程學系,電機工程學系,Department of Electrical Engineering,draft_glossary_translation,False,False,53,附錄二之二 聯合分發制招生校系名稱及代碼表：第二類組,
joint_group2_2329,joint_distribution,joint_distribution,第二類組,2329,school_040_逢甲大學,40,逢甲大學,自動控制工程學系,自動控制工程學系,Department of Automatic Movement Control Engineering,draft_glossary_translation,False,False,53,附錄二之二 聯合分發制招生校系名稱及代碼表：第二類組,
joint_group2_2330,joint_distribution,joint_distribution,第二類組,2330,school_040_逢甲大學,40,逢甲大學,通訊工程學系,通訊工程學系,Department of Communications Engineering,draft_glossary_translation,False,False,53,附錄二之二 聯合分發制招生校系名稱及代碼表：第二類組,
joint_group2_2331,joint_distribution,joint_distribution,第二類組,2331,school_040_逢甲大學,40,逢甲大學,土木工程學系,土木工程學系,Department of Civil Engineering,draft_glossary_translation,False,False,53,附錄二之二 聯合分發制招生校系名稱及代碼表：第二類組,
joint_group2_2332,joint_distribution,joint_distribution,第二類組,2332,school_040_逢甲大學,40,逢甲大學,水利工程與資源保育學系,水利工程與資源保育學系,Department of Water Benefit Engineering and Resources Care Education,draft_glossary_translation,False,False,53,附錄二之二 聯合分發制招生校系名稱及代碼表：第二類組,
joint_group2_2333,joint_distribution,joint_distribution,第二類組,2333,school_040_逢甲大學,40,逢甲大學,建築專業學院學士班,建築專業學院學士班,Bachelor Program in Architecture Specialized Industry College,draft_glossary_translation,False,False,53,附錄二之二 聯合分發制招生校系名稱及代碼表：第二類組,
joint_group2_2334,joint_distribution,joint_distribution,第二類組,2334,school_040_逢甲大學,40,逢甲大學,資訊電機學院學士班,資訊電機學院學士班,Bachelor Program in Information Electrical Mechanical College,draft_glossary_translation,False,False,53,附錄二之二 聯合分發制招生校系名稱及代碼表：第二類組,
joint_group2_2335,joint_distribution,joint_distribution,第二類組,2335,school_040_逢甲大學,40,逢甲大學,精密系統設計學士學位學程,精密系統設計學士學位學程,Bachelor Program in Precision Precision Department Systems Design,draft_glossary_translation,False,False,53,附錄二之二 聯合分發制招生校系名稱及代碼表：第二類組,
joint_group2_2336,joint_distribution,joint_distribution,第二類組,2336,school_040_逢甲大學,40,逢甲大學,美國加州聖荷西州立大學電機工程雙學士學位學程,美國加州聖荷西州立大學電機工程雙學士學位學程,Bachelor Program in San Jose State University Electrical Engineering Dual,draft_glossary_translation,False,False,53,附錄二之二 聯合分發制招生校系名稱及代碼表：第二類組,
joint_group2_2337,joint_distribution,joint_distribution,第二類組,2337,school_040_逢甲大學,40,逢甲大學,美國加州舊金山州立大學資訊工程雙學士學位學程,美國加州舊金山州立大學資訊工程雙學士學位學程,Bachelor Program in Beauty International Advanced State Heritage Finance Mountain State Established General Studies Computer Science and Information Engineering Dual,draft_glossary_translation,False,False,53,附錄二之二 聯合分發制招生校系名稱及代碼表：第二類組,
joint_group2_2338,joint_distribution,joint_distribution,第二類組,2338,school_040_逢甲大學,40,逢甲大學,人工智慧技術與應用學士學位學程,人工智慧技術與應用學士學位學程,Bachelor Program in Artificial Intelligence Technology and Applications,draft_glossary_translation,False,False,53,附錄二之二 聯合分發制招生校系名稱及代碼表：第二類組,
joint_group2_2339,joint_distribution,joint_distribution,第二類組,2339,school_040_逢甲大學,40,逢甲大學,澳洲蒙納許大學資訊工程雙學士學位學程,澳洲蒙納許大學資訊工程雙學士學位學程,Bachelor Program in Australia Studies Monash Monash Monash General Studies Computer Science and Information Engineering Dual,draft_glossary_translation,False,False,53,附錄二之二 聯合分發制招生校系名稱及代碼表：第二類組,
joint_group2_2340,joint_distribution,joint_distribution,第二類組,2340,school_040_逢甲大學,40,逢甲大學,澳洲昆士蘭大學電機工程雙學士學位學程,澳洲昆士蘭大學電機工程雙學士學位學程,Bachelor Program in University of Queensland Electrical Engineering Dual,draft_glossary_translation,False,False,53,附錄二之二 聯合分發制招生校系名稱及代碼表：第二類組,
joint_group2_2346,joint_distribution,joint_distribution,第二類組,2346,school_037_天主教輔仁大學,37,天主教輔仁大學,化學系,化學系,Department of Chemistry,draft_glossary_translation,False,False,53,附錄二之二 聯合分發制招生校系名稱及代碼表：第二類組,
joint_group2_2347,joint_distribution,joint_distribution,第二類組,2347,school_037_天主教輔仁大學,37,天主教輔仁大學,資訊工程學系,資訊工程學系,Department of Computer Science and Information Engineering,draft_glossary_translation,False,False,53,附錄二之二 聯合分發制招生校系名稱及代碼表：第二類組,
joint_group2_2348,joint_distribution,joint_distribution,第二類組,2348,school_037_天主教輔仁大學,37,天主教輔仁大學,電機工程學系,電機工程學系,Department of Electrical Engineering,draft_glossary_translation,False,False,53,附錄二之二 聯合分發制招生校系名稱及代碼表：第二類組,
joint_group2_2349,joint_distribution,joint_distribution,第二類組,2349,school_037_天主教輔仁大學,37,天主教輔仁大學,醫學資訊與創新應用學士學位學程,醫學資訊與創新應用學士學位學程,Bachelor Program in Medical Informatics and Creative New Applied,draft_glossary_translation,False,False,53,附錄二之二 聯合分發制招生校系名稱及代碼表：第二類組,
joint_group2_2350,joint_distribution,joint_distribution,第二類組,2350,school_037_天主教輔仁大學,37,天主教輔仁大學,物理學系光電物理組,物理學系光電物理組,"Department of Physics, Optoelectronic Physics Group",draft_glossary_translation,False,False,53,附錄二之二 聯合分發制招生校系名稱及代碼表：第二類組,
joint_group2_2351,joint_distribution,joint_distribution,第二類組,2351,school_037_天主教輔仁大學,37,天主教輔仁大學,數學系應用數學組,數學系應用數學組,"Department of Mathematics, Applied Mathematics Group",draft_glossary_translation,False,False,53,附錄二之二 聯合分發制招生校系名稱及代碼表：第二類組,
joint_group2_2352,joint_distribution,joint_distribution,第二類組,2352,school_037_天主教輔仁大學,37,天主教輔仁大學,數學系資訊數學組,數學系資訊數學組,"Department of Mathematics, Information Mathematics Group",draft_glossary_translation,False,False,53,附錄二之二 聯合分發制招生校系名稱及代碼表：第二類組,
joint_group2_2353,joint_distribution,joint_distribution,第二類組,2353,school_037_天主教輔仁大學,37,天主教輔仁大學,物理學系電子物理組,物理學系電子物理組,"Department of Physics, Electronic Physics Group",draft_glossary_translation,False,False,53,附錄二之二 聯合分發制招生校系名稱及代碼表：第二類組,
joint_group2_2354,joint_distribution,joint_distribution,第二類組,2354,school_051_長榮大學,51,長榮大學,資訊工程學系,資訊工程學系,Department of Computer Science and Information Engineering,draft_glossary_translation,False,False,53,附錄二之二 聯合分發制招生校系名稱及代碼表：第二類組,
joint_group2_2355,joint_distribution,joint_distribution,第二類組,2355,school_051_長榮大學,51,長榮大學,消防安全學士學位學程,消防安全學士學位學程,Bachelor Program in Fire Science Safety General,draft_glossary_translation,False,False,53,附錄二之二 聯合分發制招生校系名稱及代碼表：第二類組,
joint_group2_2356,joint_distribution,joint_distribution,第二類組,2356,school_051_長榮大學,51,長榮大學,綠能與環境資源學系,綠能與環境資源學系,Department of Green Energy and Environmental Resources,draft_glossary_translation,False,False,53,附錄二之二 聯合分發制招生校系名稱及代碼表：第二類組,
joint_group2_2357,joint_distribution,joint_distribution,第二類組,2357,school_051_長榮大學,51,長榮大學,營建工程安全學士學位學程,營建工程安全學士學位學程,Bachelor Program in Construction Engineering Safety General,draft_glossary_translation,False,False,53,附錄二之二 聯合分發制招生校系名稱及代碼表：第二類組,
joint_group2_2358,joint_distribution,joint_distribution,第二類組,2358,school_065_亞洲大學,65,亞洲大學,資訊工程學系,資訊工程學系,Department of Computer Science and Information Engineering,draft_glossary_translation,False,False,53,附錄二之二 聯合分發制招生校系名稱及代碼表：第二類組,
joint_group2_2359,joint_distribution,joint_distribution,第二類組,2359,school_065_亞洲大學,65,亞洲大學,人工智慧學系,人工智慧學系,Department of Artificial Intelligence,draft_glossary_translation,False,False,53,附錄二之二 聯合分發制招生校系名稱及代碼表：第二類組,
joint_group2_2360,joint_distribution,joint_distribution,第二類組,2360,school_065_亞洲大學,65,亞洲大學,資訊傳播學系,資訊傳播學系,Department of Information Communication,draft_glossary_translation,False,False,53,附錄二之二 聯合分發制招生校系名稱及代碼表：第二類組,
joint_group2_2361,joint_distribution,joint_distribution,第二類組,2361,school_065_亞洲大學,65,亞洲大學,室內設計學系,室內設計學系,Department of Interior Design,draft_glossary_translation,False,False,53,附錄二之二 聯合分發制招生校系名稱及代碼表：第二類組,
joint_group2_2362,joint_distribution,joint_distribution,第二類組,2362,school_054_大葉大學,54,大葉大學,機械與自動化工程學系,機械與自動化工程學系,Department of Mechanical and Automation Engineering,draft_glossary_translation,False,False,53,附錄二之二 聯合分發制招生校系名稱及代碼表：第二類組,
joint_group2_2363,joint_distribution,joint_distribution,第二類組,2363,school_054_大葉大學,54,大葉大學,電機工程學系,電機工程學系,Department of Electrical Engineering,draft_glossary_translation,False,False,53,附錄二之二 聯合分發制招生校系名稱及代碼表：第二類組,
joint_group2_2364,joint_distribution,joint_distribution,第二類組,2364,school_054_大葉大學,54,大葉大學,環境與安全工程學系,環境與安全工程學系,Department of Environment and Safety General Engineering,draft_glossary_translation,False,False,53,附錄二之二 聯合分發制招生校系名稱及代碼表：第二類組,
joint_group2_2365,joint_distribution,joint_distribution,第二類組,2365,school_054_大葉大學,54,大葉大學,資訊工程學系,資訊工程學系,Department of Computer Science and Information Engineering,draft_glossary_translation,False,False,53,附錄二之二 聯合分發制招生校系名稱及代碼表：第二類組,
joint_group2_2366,joint_distribution,joint_distribution,第二類組,2366,school_054_大葉大學,54,大葉大學,半導體學士學位學程,半導體學士學位學程,Bachelor Program in Semiconductor,draft_glossary_translation,False,False,53,附錄二之二 聯合分發制招生校系名稱及代碼表：第二類組,
joint_group2_2369,joint_distribution,joint_distribution,第二類組,2369,school_041_東吳大學,41,東吳大學,數學系,數學系,Department of Mathematics,draft_glossary_translation,False,False,53,附錄二之二 聯合分發制招生校系名稱及代碼表：第二類組,
joint_group2_2370,joint_distribution,joint_distribution,第二類組,2370,school_041_東吳大學,41,東吳大學,物理學系,物理學系,Department of Physics,draft_glossary_translation,False,False,53,附錄二之二 聯合分發制招生校系名稱及代碼表：第二類組,
joint_group2_2371,joint_distribution,joint_distribution,第二類組,2371,school_041_東吳大學,41,東吳大學,化學系,化學系,Department of Chemistry,draft_glossary_translation,False,False,53,附錄二之二 聯合分發制招生校系名稱及代碼表：第二類組,
joint_group2_2372,joint_distribution,joint_distribution,第二類組,2372,school_041_東吳大學,41,東吳大學,財務工程與精算數學系,財務工程與精算數學系,Department of Financial Engineering and Precision Computing Mathematics,draft_glossary_translation,False,False,53,附錄二之二 聯合分發制招生校系名稱及代碼表：第二類組,
joint_group2_2373,joint_distribution,joint_distribution,第二類組,2373,school_041_東吳大學,41,東吳大學,資料科學系第2類組,資料科學系第2類組,"Department of Data Materials Science, Group 2 Group Group",draft_glossary_translation,False,False,54,附錄二之二 聯合分發制招生校系名稱及代碼表：第二類組,
joint_group2_2374,joint_distribution,joint_distribution,第二類組,2374,school_053_開南大學,53,開南大學,AI科技與創新設計學士學位學程,AI科技與創新設計學士學位學程,Bachelor Program in AI Technology and Innovation Design,draft_glossary_translation,False,False,54,附錄二之二 聯合分發制招生校系名稱及代碼表：第二類組,
joint_group2_2375,joint_distribution,joint_distribution,第二類組,2375,school_042_元智大學,42,元智大學,工業工程與管理學系,工業工程與管理學系,Department of Industrial Engineering and Management,draft_glossary_translation,False,False,54,附錄二之二 聯合分發制招生校系名稱及代碼表：第二類組,
joint_group2_2376,joint_distribution,joint_distribution,第二類組,2376,school_042_元智大學,42,元智大學,化學工程與材料科學學系,化學工程與材料科學學系,Department of Chemical Engineering and Materials Science,draft_glossary_translation,False,False,54,附錄二之二 聯合分發制招生校系名稱及代碼表：第二類組,
joint_group2_2377,joint_distribution,joint_distribution,第二類組,2377,school_042_元智大學,42,元智大學,機械工程學系,機械工程學系,Department of Mechanical Engineering,draft_glossary_translation,False,False,54,附錄二之二 聯合分發制招生校系名稱及代碼表：第二類組,
joint_group2_2378,joint_distribution,joint_distribution,第二類組,2378,school_042_元智大學,42,元智大學,資訊工程學系,資訊工程學系,Department of Computer Science and Information Engineering,draft_glossary_translation,False,False,54,附錄二之二 聯合分發制招生校系名稱及代碼表：第二類組,
joint_group2_2379,joint_distribution,joint_distribution,第二類組,2379,school_042_元智大學,42,元智大學,電機工程學系丙組,電機工程學系丙組,"Department of Electrical Engineering, C Group",draft_glossary_translation,False,False,54,附錄二之二 聯合分發制招生校系名稱及代碼表：第二類組,
joint_group2_2380,joint_distribution,joint_distribution,第二類組,2380,school_042_元智大學,42,元智大學,電機工程學系乙組,電機工程學系乙組,"Department of Electrical Engineering, B Group",draft_glossary_translation,False,False,54,附錄二之二 聯合分發制招生校系名稱及代碼表：第二類組,
joint_group2_2381,joint_distribution,joint_distribution,第二類組,2381,school_042_元智大學,42,元智大學,電機工程學系甲組,電機工程學系甲組,"Department of Electrical Engineering, A Group",draft_glossary_translation,False,False,54,附錄二之二 聯合分發制招生校系名稱及代碼表：第二類組,
joint_group2_2382,joint_distribution,joint_distribution,第二類組,2382,school_042_元智大學,42,元智大學,資訊傳播學系智慧科技應用組,資訊傳播學系智慧科技應用組,"Department of Information Communication, Smart Technology Applications Group",draft_glossary_translation,False,False,54,附錄二之二 聯合分發制招生校系名稱及代碼表：第二類組,
joint_group2_2383,joint_distribution,joint_distribution,第二類組,2383,school_042_元智大學,42,元智大學,工程學院英語學士班(重點產業系所),工程學院英語學士班,Bachelor Program in Engineering College English,draft_glossary_translation,True,False,54,附錄二之二 聯合分發制招生校系名稱及代碼表：第二類組,
joint_group2_2384,joint_distribution,joint_distribution,第二類組,2384,school_042_元智大學,42,元智大學,電機通訊學院英語學士班(重點產業系所),電機通訊學院英語學士班,Bachelor Program in Electrical Mechanical Communication Information College English,draft_glossary_translation,True,False,54,附錄二之二 聯合分發制招生校系名稱及代碼表：第二類組,
joint_group2_2385,joint_distribution,joint_distribution,第二類組,2385,school_057_南華大學,57,南華大學,資訊工程學系,資訊工程學系,Department of Computer Science and Information Engineering,draft_glossary_translation,False,False,54,附錄二之二 聯合分發制招生校系名稱及代碼表：第二類組,
joint_group2_2386,joint_distribution,joint_distribution,第二類組,2386,school_036_中原大學,36,中原大學,應用數學系,應用數學系,Department of Applied Mathematics,draft_glossary_translation,False,False,54,附錄二之二 聯合分發制招生校系名稱及代碼表：第二類組,
joint_group2_2387,joint_distribution,joint_distribution,第二類組,2387,school_036_中原大學,36,中原大學,物理學系物理組,物理學系物理組,"Department of Physics, Physics Group",draft_glossary_translation,False,False,54,附錄二之二 聯合分發制招生校系名稱及代碼表：第二類組,
joint_group2_2388,joint_distribution,joint_distribution,第二類組,2388,school_036_中原大學,36,中原大學,物理學系光電與材料科學組,物理學系光電與材料科學組,"Department of Physics, Optical Electrical and Materials Science Studies Group",draft_glossary_translation,False,False,54,附錄二之二 聯合分發制招生校系名稱及代碼表：第二類組,
joint_group2_2389,joint_distribution,joint_distribution,第二類組,2389,school_036_中原大學,36,中原大學,化學系化學組,化學系化學組,"Department of Chemistry, Chemistry Group",draft_glossary_translation,False,False,54,附錄二之二 聯合分發制招生校系名稱及代碼表：第二類組,
joint_group2_2390,joint_distribution,joint_distribution,第二類組,2390,school_036_中原大學,36,中原大學,化學系材料化學組,化學系材料化學組,"Department of Chemistry, Materials Chemistry Group",draft_glossary_translation,False,False,54,附錄二之二 聯合分發制招生校系名稱及代碼表：第二類組,
joint_group2_2391,joint_distribution,joint_distribution,第二類組,2391,school_036_中原大學,36,中原大學,土木工程學系,土木工程學系,Department of Civil Engineering,draft_glossary_translation,False,False,54,附錄二之二 聯合分發制招生校系名稱及代碼表：第二類組,
joint_group2_2392,joint_distribution,joint_distribution,第二類組,2392,school_036_中原大學,36,中原大學,機械工程學系,機械工程學系,Department of Mechanical Engineering,draft_glossary_translation,False,False,54,附錄二之二 聯合分發制招生校系名稱及代碼表：第二類組,
joint_group2_2393,joint_distribution,joint_distribution,第二類組,2393,school_036_中原大學,36,中原大學,生物醫學工程學系,生物醫學工程學系,Department of Biomedical Engineering,draft_glossary_translation,False,False,54,附錄二之二 聯合分發制招生校系名稱及代碼表：第二類組,
joint_group2_2394,joint_distribution,joint_distribution,第二類組,2394,school_036_中原大學,36,中原大學,電子工程學系,電子工程學系,Department of Electronic Engineering,draft_glossary_translation,False,False,54,附錄二之二 聯合分發制招生校系名稱及代碼表：第二類組,
joint_group2_2395,joint_distribution,joint_distribution,第二類組,2395,school_036_中原大學,36,中原大學,資訊工程學系,資訊工程學系,Department of Computer Science and Information Engineering,draft_glossary_translation,False,False,54,附錄二之二 聯合分發制招生校系名稱及代碼表：第二類組,
joint_group2_2396,joint_distribution,joint_distribution,第二類組,2396,school_036_中原大學,36,中原大學,電機工程學系,電機工程學系,Department of Electrical Engineering,draft_glossary_translation,False,False,54,附錄二之二 聯合分發制招生校系名稱及代碼表：第二類組,
joint_group2_2397,joint_distribution,joint_distribution,第二類組,2397,school_036_中原大學,36,中原大學,建築學系,建築學系,Department of Architecture,draft_glossary_translation,False,False,54,附錄二之二 聯合分發制招生校系名稱及代碼表：第二類組,
joint_group2_2398,joint_distribution,joint_distribution,第二類組,2398,school_036_中原大學,36,中原大學,電機資訊學院學士班,電機資訊學院學士班,Bachelor Program in College of Electrical Engineering and Computer Science,draft_glossary_translation,False,False,54,附錄二之二 聯合分發制招生校系名稱及代碼表：第二類組,
joint_group2_2399,joint_distribution,joint_distribution,第二類組,2399,school_036_中原大學,36,中原大學,環境工程學系,環境工程學系,Department of Environmental Engineering,draft_glossary_translation,False,False,54,附錄二之二 聯合分發制招生校系名稱及代碼表：第二類組,
